终结者2：审判日,8.8,307684,少见的超越首部的续集，动作片中的经典。,詹姆斯·卡梅隆,阿诺·施瓦辛格,动作,美国,1991
东京教父,9.0,179443,暂无介绍,今敏,江守彻,剧情,日本,2003
二十二,8.7,269151,有一些东西不应该被遗忘。,郭柯,<br/>,纪录片,中国大陆,2015
奇迹男孩,8.6,505985,世界不完美，爱会有奇迹。,斯蒂芬·卓博斯基,雅各布·特伦布莱,剧情,美国,2017
青蛇,8.6,465429,人生如此，浮生如斯。谁人言，花彼岸，此生情长意短。谁都是不懂爱的罢了。,徐克,张曼玉,剧情,中国香港,1993
背靠背，脸对脸,9.5,97375,暂无介绍,黄建新,牛振华,剧情,中国大陆,1994
房间,8.8,340811,被偷走的岁月，被伤害的生命，被禁锢的灵魂，终将被希望和善意救赎。,伦尼·阿伯拉罕森,布丽·拉尔森,剧情,爱尔兰,2015
新龙门客栈,8.6,394940,嬉笑怒骂，调风动月。,李惠民,张曼玉,动作,中国香港,1992
疯狂的麦克斯4：狂暴之路,8.6,469110,“多么美好的一天！”轰轰轰砰咚，啪哒哒哒轰隆隆，磅~,乔治·米勒,汤姆·哈迪,动作,澳大利亚,2015
波西米亚狂想曲,8.6,529335,暂无介绍,布莱恩·辛格,拉米·马雷克,剧情,英国,2018
小丑,8.7,895338,暂无介绍,托德·菲利普斯,杰昆·菲尼克斯,剧情,美国,2019
无耻混蛋,8.6,424009,昆汀同学越来越变态了，比北野武还杜琪峰。,Quentin,布拉德·皮特,剧情,德国,2009
魂断蓝桥,8.8,248012,中国式内在的美国电影。,茂文·勒鲁瓦,费雯·丽,剧情,美国,1940
血钻,8.7,334767,每个美丽事物背后都是滴血的现实。,爱德华·兹威克,莱昂纳多·迪卡普里奥,剧情,美国,2006
步履不停,8.8,244929,日本的家庭电影已经是世界巅峰了，步履不停是巅峰中的佳作。,是枝裕和,阿部宽,剧情,日本,2008
黑客帝国2：重装上阵,8.7,364554,一个精彩的世界观正在缓缓建立。,信息不全,信息不全,信息不全,信息不全,信息不全
千钧一发,8.8,250662,一部能引人思考的科幻励志片。,安德鲁·尼科尔,伊桑·霍克,剧情,美国,1997
彗星来的那一夜,8.5,490998,小成本大魅力。,詹姆斯·沃德·布柯特,艾米丽·芭尔多尼,科幻,美国,2013
战争之王,8.7,323409,做一颗让别人需要你的棋子。,安德鲁·尼科尔,尼古拉斯·凯奇,剧情,法国,2005
崖上的波妞,8.6,421425,暂无介绍,宫崎骏,奈良柚莉爱,动画,日本,2008
燃情岁月,8.8,259536,传奇，不是每个人都可以拥有。,爱德华·兹威克,布拉德·皮特,剧情,美国,1994
谍影重重2,8.7,317117,谁说王家卫镜头很晃？,保罗·格林格拉斯,马特·达蒙,动作,美国,2004
爱乐之城,8.4,766716,暂无介绍,达米恩·查泽雷,瑞恩·高斯林,剧情,美国,2016
海洋,9.1,147035,大海啊，不全是水。,雅克·贝汉,2009,纪录片,法国,2009
阿飞正传,8.5,449770,王家卫是一种风格，张国荣是一个代表。,王家卫,张国荣,犯罪,中国香港,1990
谍影重重,8.6,380754,哗啦啦啦啦，天在下雨，哗啦啦啦啦，云在哭泣……找自己。,道格·里曼,马特·达蒙,动作,美国,2002
穿越时空的少女,8.6,347016,爱上未来的你。 ,细田守,仲里依纱,剧情,日本,2006
再次出发之纽约遇见你,8.6,383909,爱我就给我看你的播放列表。,约翰·卡尼,凯拉·奈特莉,喜剧,美国,2013
香水,8.5,497719,一个单凭体香达到高潮的男人。,汤姆·提克威,本·卫肖,剧情,德国,2006
地球上的星星,8.9,185455,天使保护事件始末。,阿米尔·汗,达席尔·萨法瑞,剧情,印度,2007
我爱你,9.1,148598,你要相信，这世上真的有爱存在，不管在什么年纪 ,秋昌民,宋在河,剧情,韩国,2011
朗读者,8.6,419384,当爱情跨越年龄的界限，它似乎能变得更久远一点，成为一种责任，一种水到渠成的相濡以沫。 ,史蒂芬·戴德利,凯特·温丝莱特,剧情,美国,2008
完美陌生人,8.5,481521,来啊，互相伤害啊！,保罗·格诺维瑟,马可·贾利尼,剧情,意大利,2016
火星救援,8.5,633354,暂无介绍,雷德利·斯科特,马特·达蒙,剧情,英国,2015
末路狂花,8.8,203098,没有了退路，只好飞向自由。,雷德利·斯科特,吉娜·戴维斯,犯罪,美国,1991
千年女优,8.8,217767,爱情是一场没有尽头的虚幻追逐。,今敏,庄司美代子,动画,日本,2001
聚焦,8.8,249521,新闻人的理性求真。,托马斯·麦卡锡,马克·鲁弗洛,剧情,美国,2015
驴得水,8.3,832835,过去的如果就让它过去了，未来只会越来越糟！,周申,任素汐,剧情,中国大陆,2016
小萝莉的猴神大叔,8.4,445138,宝莱坞的萝莉与大叔。,卡比尔·汗,萨尔曼·汗,剧情,印度,2015
浪潮,8.7,245781,世界离独裁只有五天。,丹尼斯·甘塞尔,尤尔根·沃格尔,剧情,德国,2008
