肖申克的救赎,9.7,2576223,希望让人自由。,弗兰克·德拉邦特,蒂姆·罗宾斯,犯罪,美国,1994
霸王别姬,9.6,1913264,风华绝代。,陈凯歌,张国荣,剧情,中国大陆,1993
阿甘正传,9.5,1935532,一部美国近现代史。,罗伯特·泽米吉斯,汤姆·汉克斯,剧情,美国,1994
泰坦尼克号,9.4,1897016,失去的才是永恒的。 ,詹姆斯·卡梅隆,莱昂纳多·迪卡普里奥,剧情,美国,1997
这个杀手不太冷,9.4,2091693,怪蜀黍和小萝莉不得不说的故事。,吕克·贝松,让·雷诺,剧情,法国,1994
美丽人生,9.6,1188517,最美的谎言。,罗伯托·贝尼尼,罗伯托·贝尼尼,剧情,意大利,1997
千与千寻,9.4,2015421,最好的宫崎骏，最好的久石让。 ,宫崎骏,柊瑠美,剧情,日本,2001
辛德勒的名单,9.6,991386,拯救一个人，就是拯救整个世界。,史蒂文·斯皮尔伯格,连姆·尼森,剧情,美国,1993
盗梦空间,9.4,1857441,诺兰给了我们一场无法盗取的梦。,克里斯托弗·诺兰,莱昂纳多·迪卡普里奥,剧情,美国,2010
忠犬八公的故事,9.4,1272301,永远都不能忘记你所爱的人。,莱塞·霍尔斯道姆,理查·基尔,剧情,美国,2009
星际穿越,9.4,1541540,爱是一种力量，让我们超越时空感知它的存在。,克里斯托弗·诺兰,马修·麦康纳,剧情,美国,2014
楚门的世界,9.3,1463763,如果再也不能见到你，祝你早安，午安，晚安。,彼得·威尔,金·凯瑞,剧情,美国,1998
海上钢琴师,9.3,1509316,每个人都要走一条自己坚定了的路，就算是粉身碎骨。 ,朱塞佩·托纳多雷,蒂姆·罗斯,剧情,意大利,1998
三傻大闹宝莱坞,9.2,1687627,英俊版憨豆，高情商版谢耳朵。,拉库马·希拉尼,阿米尔·汗,剧情,印度,2009
机器人总动员,9.3,1189687,小瓦力，大人生。,安德鲁·斯坦顿,本·贝尔特,科幻,美国,2008
放牛班的春天,9.3,1174303,天籁一般的童声，是最接近上帝的存在。 ,克里斯托夫·巴拉蒂,热拉尔·朱尼奥,剧情,法国,2004
无间道,9.3,1183955,香港电影史上永不过时的杰作。,刘伟强,刘德华,剧情,中国香港,2002
疯狂动物城,9.2,1693098,迪士尼给我们营造的乌托邦就是这样，永远善良勇敢，永远出乎意料。,拜伦·霍华德,金妮弗·...<br/>,喜剧,美国,2016
大话西游之大圣娶亲,9.2,1379469,一生所爱。,刘镇伟,周星驰,喜剧,中国香港,1995
熔炉,9.3,839030,我们一路奋战不是为了改变世界，而是为了不让世界改变我们。,黄东赫,孔侑,剧情,韩国,2011
教父,9.3,849128,千万不要记恨你的对手，这样会让你失去理智。,弗朗西斯·福特·科波拉,马龙·白兰度,剧情,美国,1972
当幸福来敲门,9.2,1366868,平民励志片。 ,加布里尔·穆奇诺,威尔·史密斯,剧情,美国,2006
控方证人,9.6,442052,比利·怀德满分作品。,比利·怀尔德,泰隆·鲍华,剧情,美国,1957
怦然心动,9.1,1636863,真正的幸福是来自内心深处。,罗伯·莱纳,玛德琳·卡罗尔,剧情,美国,2010
龙猫,9.2,1137796,人人心中都有个龙猫，童年就永远不会消失。,宫崎骏,日高法子,动画,日本,1988
触不可及,9.3,943409,满满温情的高雅喜剧。,信息不全,信息不全,信息不全,信息不全,信息不全
末代皇帝,9.3,757815,“不要跟我比惨，我比你更惨”再适合这部电影不过了。,贝纳尔多·贝托鲁奇,尊龙,剧情,英国,1987
寻梦环游记,9.1,1456981,死亡不是真的逝去，遗忘才是永恒的消亡。,李·昂克里奇,...<br/>,喜剧,美国,2017
蝙蝠侠：黑暗骑士,9.2,938417,无尽的黑暗。,克里斯托弗·诺兰,克里斯蒂安·贝尔,剧情,美国,2008
活着,9.3,734560,张艺谋最好的电影。,张艺谋,葛优,剧情,中国大陆,1994
哈利·波特与魔法石,9.1,1019591,童话世界的开端。,Chris,Daniel,奇幻,美国,2001
指环王3：王者无敌,9.3,715975,史诗的终章。,彼得·杰克逊,伊利亚·伍德,剧情,美国,2003
乱世佳人,9.3,618674,Tomorrow is another day.,维克多·弗莱明,费...<br/>,剧情,美国,1939
素媛,9.3,605065,受过伤害的人总是笑得最开心，因为他们不愿意让身边的人承受一样的痛苦。,李濬益,薛景求,剧情,韩国,2013
飞屋环游记,9.1,1189321,最后那些最无聊的事情，才是最值得怀念的。 ,彼特·道格特,爱德...<br/>,剧情,美国,2009
摔跤吧！爸爸,9.0,1413180,你不是在为你一个人战斗，你要让千千万万的女性看到女生并不是只能相夫教子。,涅提·蒂瓦里,阿米尔·汗,剧情,印度,2016
何以为家,9.1,923328,凝视卑弱生命，用电影改变命运。,娜丁·拉巴基,扎因·拉费阿,剧情,黎巴嫩,2018
我不是药神,9.0,1886334,对我们国家而言，这样的电影多一部是一部。,文牧野,徐峥,剧情,中国大陆,2018
十二怒汉,9.4,422875,1957年的理想主义。 ,Sidney,亨利·方达,剧情,美国,1957
哈尔的移动城堡,9.1,897827,带着心爱的人在天空飞翔。,宫崎骏,倍赏千惠子,动画,日本,2004
少年派的奇幻漂流,9.1,1226347,瑰丽壮观、无人能及的冒险之旅。,李安,苏拉·沙玛,剧情,美国,2012
鬼子来了,9.3,553423,对敌人的仁慈，就是对自己残忍。,姜文,姜文,剧情,中国大陆,2000
大话西游之月光宝盒,9.0,1099658,旷古烁今。,刘镇伟,周星驰,喜剧,中国香港,1995
天空之城,9.1,739725,对天空的追逐，永不停止。 ,宫崎骏,田中真弓,动画,日本,1986
猫鼠游戏,9.1,856615,骗子大师和执著警探的你追我跑故事。 ,史蒂文·斯皮尔伯格,莱昂纳多·迪卡普里奥,传记,美国,2002
天堂电影院,9.2,617840,那些吻戏，那些青春，都在影院的黑暗里被泪水冲刷得无比清晰。,朱塞佩·托纳多雷,菲利普·努瓦雷,剧情,意大利,1988
指环王2：双塔奇兵,9.2,667957,承前启后的史诗篇章。,彼得·杰克逊,伊利亚·伍德,剧情,美国,2002
闻香识女人,9.1,775611,史上最美的探戈。,马丁·布莱斯,阿尔·帕西诺,剧情,美国,1992
罗马假日,9.1,862970,爱情哪怕只有一天。,威廉·惠勒,奥黛丽·赫本,喜剧,美国,1953
钢琴家,9.2,528881,音乐能化解仇恨。,罗曼·波兰斯基,艾德里安·布洛迪,剧情,英国,2002
让子弹飞,8.9,1489420,你给我翻译翻译，神马叫做TMD的惊喜。,姜文,姜文,剧情,中国大陆,2010
指环王1：护戒使者,9.1,755845,传说的开始。,彼得·杰克逊,伊利亚·伍德,剧情,新西兰,2001
黑客帝国,9.1,752980,视觉革命。,信息不全,信息不全,信息不全,信息不全,信息不全
海蒂和爷爷,9.3,467185,如果生活中有什么使你感到快乐，那就去做吧！不要管别人说什么。,阿兰·葛斯彭纳,阿努克·斯特芬,剧情,德国,2015
大闹天宫,9.4,377816,经典之作，历久弥新。,万籁鸣,邱岳峰,剧情,中国大陆,1961
辩护人,9.2,534346,电影的现实意义大过电影本身。,杨宇硕,宋康昊,剧情,韩国,2013
教父2,9.2,479802,优雅的孤独。,弗朗西斯·福特·科波拉,阿尔·帕西诺,剧情,美国,1974
死亡诗社,9.1,626405,当一个死水般的体制内出现一个活跃的变数时，所有的腐臭都站在了光明的对面。,彼得·威尔,罗宾·威廉姆斯,剧情,美国,1989
狮子王,9.1,743746,动物版《哈姆雷特》。,Roger,乔纳森·泰勒·托马...<br/>,动画,美国,1994
绿皮书,8.9,1426842,去除成见，需要勇气。,彼得·法雷里,维果·莫腾森,剧情,美国,2018
搏击俱乐部,9.0,759467,邪恶与平庸蛰伏于同一个母体，在特定的时间互相对峙。,大卫·芬奇,爱德华·诺顿,剧情,美国,1999
饮食男女,9.2,541638,人生不能像做菜，把所有的料都准备好了才下锅。,李安,郎雄,剧情,中国台湾,1994
美丽心灵,9.1,684322,爱是一切逻辑和原由。,朗·霍华德,罗素·克劳,传记,美国,2001
本杰明·巴顿奇事,9.0,880616,在时间之河里感受溺水之苦。,大卫·芬奇,凯特·布兰切特,剧情,美国,2008
窃听风暴,9.2,502562,别样人生。,信息不全,信息不全,信息不全,信息不全,信息不全
情书,8.9,954291,暗恋的极致。,岩井俊二,中山美穗,剧情,日本,1995
两杆大烟枪,9.1,537920,4个臭皮匠顶个诸葛亮，盖·里奇果然不是盖的。,Guy,Jason,剧情,英国,1998
穿条纹睡衣的男孩,9.2,481362,尽管有些不切实际的幻想，这部电影依旧是一部感人肺腑的佳作。,马克·赫尔曼,阿萨·巴特菲尔德,剧情,英国,2008
西西里的美丽传说,8.9,873461,美丽无罪。,朱塞佩·托纳多雷,莫妮卡·贝鲁奇,剧情,意大利,2000
看不见的客人,8.8,1109854,你以为你以为的就是你以为的。,奥里奥尔·保罗,马里奥·卡萨斯,剧情,西班牙,2016
拯救大兵瑞恩,9.1,579322,美利坚精神输出大片No1.,史蒂文·斯皮尔伯格,汤姆·汉克斯,剧情,美国,1998
飞越疯人院,9.1,501166,自由万岁。,米洛斯·福尔曼,杰克·尼科尔森,剧情,美国,1975
音乐之声,9.1,535883,用音乐化解仇恨，让歌声串起美好。,罗伯特·怀斯,朱莉·安德鲁斯,剧情,美国,1965
小鞋子,9.2,364086,奔跑的孩子是天使。,马基德·马基迪,默罕默德·阿米尔·纳吉,剧情,伊朗,1997
阿凡达,8.8,1245278,绝对意义上的美轮美奂。,詹姆斯·卡梅隆,萨姆·沃辛顿,动作,美国,2009
海豚湾,9.3,331357,海豚的微笑，是世界上最高明的伪装。,路易·西霍尤斯,Richard,纪录片,美国,2009
哈利·波特与死亡圣器(下),8.9,723190,10年的完美句点。,大卫·叶茨,丹尼尔·雷德克里夫,奇幻,美国,2011
沉默的羔羊,8.9,779941,安东尼·霍普金斯的顶级表演。,乔纳森·戴米,朱迪·福斯特,剧情,美国,1991
致命魔术,8.9,767381,孪生蝙蝠侠大战克隆金刚狼。,克里斯托弗·诺兰,休·杰克曼,剧情,英国,2006
禁闭岛,8.8,858570,昔日翩翩少年，今日大腹便便。,Martin,莱昂纳多·迪卡普里奥,剧情,美国,2010
美国往事,9.2,368636,往事如烟，无处祭奠。,赛尔乔·莱翁内,罗伯特·德尼罗,犯罪,美国,1984
布达佩斯大饭店,8.9,810613,小清新的故事里注入了大历史的情怀。,韦斯·安德森,拉尔夫·费因斯,剧情,美国,2014
蝴蝶效应,8.8,835733,人的命运被自己瞬间的抉择改变。,信息不全,信息不全,信息不全,信息不全,信息不全
心灵捕手,8.9,632054,人生中应该拥有这样的一段豁然开朗。,格斯·范·桑特,马特·达蒙,剧情,美国,1997
低俗小说,8.9,742198,故事的高级讲法。,昆汀·塔伦蒂诺,约翰·特拉沃尔塔,剧情,美国,1994
春光乍泄,9.0,559616,爱情纠缠，男女一致。,王家卫,张国荣,剧情,中国香港,1997
摩登时代,9.3,263647,大时代中的人生，小人物的悲喜。,查理·卓别林,查理·卓别林,剧情,美国,1936
七宗罪,8.8,855845,警察抓小偷，老鼠玩死猫。,大卫·芬奇,摩根·弗里曼,剧情,美国,1995
喜剧之王,8.8,860462,我是一个演员。,周星驰,周星驰,喜剧,中国香港,1999
致命ID,8.8,723336,最不可能的那个人永远是最可能的。,詹姆斯·曼高德,约翰·库萨克,剧情,美国,2003
杀人回忆,8.9,616994,关于连环杀人悬案的集体回忆。,奉俊昊,宋康昊,剧情,韩国,2003
被嫌弃的松子的一生,8.9,643266,以戏谑来戏谑戏谑。,中岛哲也,中谷美纪,剧情,日本,2006
加勒比海盗,8.8,770324,约翰尼·德普的独角戏。,戈尔·维宾斯基,约翰尼·德普,动作,美国,2003
功夫,8.7,953885,警恶惩奸，维护世界和平这个任务就交给你了，好吗？,周星驰,周星驰,动作,中国大陆,2004
红辣椒,9.0,391344,梦的勾结。,今敏,林原惠美,动画,日本,2006
哈利·波特与阿兹卡班的囚徒,8.9,609321,不一样的导演，不一样的哈利·波特。,Alfonso,丹尼尔·雷德克里夫,奇幻,英国,2004
超脱,9.0,481281,穷尽一生，我们要学会的，不过是彼此拥抱。,托尼·凯耶,艾德里安·布洛迪,剧情,美国,2011
狩猎,9.1,338236,人言可畏。,托马斯·温特伯格,麦斯·米科尔森,剧情,丹麦,2012
请以你的名字呼唤我,8.9,628490,沉醉在电影的情感和视听氛围中无法自拔。,卢卡·瓜达尼诺,艾米·汉莫,剧情,意大利,2017
剪刀手爱德华,8.7,954884,浪漫忧郁的成人童话。,蒂姆·波顿,约翰尼·德普,剧情,美国,1990
7号房的礼物,8.9,491207,《我是山姆》的《美丽人生》。,李焕庆,柳承龙,剧情,韩国,2013
勇敢的心,8.9,518885,史诗大片的典范。,梅尔·吉布森,梅尔·吉布森,动作,美国,1995
断背山,8.8,642973,每个人心中都有一座断背山。,李安,希斯·莱杰,剧情,美国,2005
唐伯虎点秋香,8.7,951942,华太师是黄霑，吴镇宇四大才子之一。,李力持,周星驰,喜剧,中国香港,1993
天使爱美丽,8.7,894960,法式小清新。 ,让-皮埃尔·热内,奥黛丽·塔图,剧情,法国,2001
第六感,8.9,494474,深入内心的恐怖，出人意料的结局。,M·奈特·沙马兰,布鲁斯·威利斯,剧情,美国,1999
入殓师,8.9,582190,死可能是一道门，逝去并不是终结，而是超越，走向下一程。,泷田洋二郎,本木雅弘,剧情,日本,2008
幽灵公主,8.9,472394,人与自然的战争史诗。,宫崎骏,松田洋治,动画,日本,1997
重庆森林,8.8,712371,寂寞没有期限。,王家卫,林青霞,剧情,中国香港,1994
爱在黎明破晓前,8.8,582410,缘分是个连绵词，最美不过一瞬。,理查德·林克莱特,伊桑·霍克,剧情,美国,1995
哈利·波特与密室,8.8,635601,魔法的密室之门已打开...,Chris,丹尼尔·雷德克里夫,奇幻,英国,2002
小森林 夏秋篇,9.0,379864,那些静得只能听见呼吸的日子里，你明白孤独即生活。,森淳一,桥本爱,剧情,日本,2014
一一,9.1,325586,我们都曾经是一一。,杨德昌,吴念真,剧情,中国台湾,2000
阳光灿烂的日子,8.8,551113,一场华丽的意淫。,姜文,夏雨,剧情,中国大陆,1994
蝙蝠侠：黑暗骑士崛起,8.8,638804,诺兰就是保证。,克里斯托弗·诺兰,克里斯蒂安·贝尔,剧情,美国,2012
菊次郎的夏天,8.9,523260,从没见过那么流氓的温柔，从没见过那么温柔的流氓。,北野武,北野武,剧情,日本,1999
超能陆战队,8.7,902792,Balalala~~~,唐·霍尔,斯科特...<br/>,喜剧,美国,2014
无人知晓,9.1,275485,我的平常生活就是他人的幸福。,是枝裕和,柳乐优弥,剧情,日本,2004
消失的爱人,8.7,821802,年度最佳date movie。,大卫·芬奇,本·阿弗莱克,剧情,美国,2014
完美的世界,9.1,269752,坏人的好总是比好人的好来得更感人。,克林特·伊斯特伍德,凯文·科斯特纳,剧情,美国,1993
爱在日落黄昏时,8.9,480068,九年后的重逢是世俗和责任的交叠，没了悸动和青涩，沧桑而温暖。,理查德·林克莱特,伊桑·霍克,剧情,美国,2004
小森林 冬春篇,9.0,340160,尊敬他人，尊敬你生活的这片土地，明白孤独是人生的常态。,森淳一,桥本爱,剧情,日本,2015
倩女幽魂,8.8,656868,两张绝世的脸。 ,程小东,张国荣,爱情,中国香港,1987
借东西的小人阿莉埃蒂,8.9,488326,曾经的那段美好会沉淀为一辈子的记忆。,米林宏昌,志田未来,动画,日本,2010
甜蜜蜜,8.9,466409,相逢只要一瞬间，等待却像是一辈子。,陈可辛,黎明,剧情,中国香港,1996
侧耳倾听,8.9,410707,少女情怀总是诗。,近藤喜文,本名阳子,剧情,日本,1995
萤火之森,8.9,468112,触不到的恋人。,大森贵弘,佐仓绫音,剧情,日本,2011
幸福终点站,8.8,497489,有时候幸福需要等一等。 ,史蒂文·斯皮尔伯格,汤姆·汉克斯,喜剧,美国,2004
驯龙高手,8.7,679279,和谐的生活离不开摸头与被摸头。,迪恩·德布洛斯,2010,动画,美国,2010
时空恋旅人,8.8,564629,把每天当作最后一天般珍惜度过，积极拥抱生活，就是幸福。,理查德·柯蒂斯,多姆纳尔·格里森,喜剧,英国,2013
玛丽和马克思,8.9,390304,你是我最好的朋友，你是我唯一的朋友 。,亚当·艾略特,托妮·科莱特,剧情,澳大利亚,2009
怪兽电力公司,8.8,590340,不要给它起名字，起了名字就有感情了。,彼特·道格特,约...<br/>,儿童,美国,2001
大鱼,8.8,513531,抱着梦想而活着的人是幸福的，怀抱梦想而死去的人是不朽的。,蒂姆·波顿,伊万·麦克格雷格,剧情,美国,2003
告白,8.8,616063,没有一人完全善，也没有一人完全恶。,中岛哲也,松隆子,剧情,日本,2010
教父3,9.0,322932,任何信念的力量，都无法改变命运。,弗朗西斯·福特·科波拉,阿尔·帕西诺,剧情,美国,1990
一个叫欧维的男人决定去死,8.9,396312,惠及一生的美丽。,汉内斯·赫尔姆,罗夫·拉斯加德,剧情,瑞典,2015
阳光姐妹淘,8.8,547536,再多各自牛逼的时光，也比不上一起傻逼的岁月。 ,姜炯哲,沈恩京,剧情,韩国,2011
神偷奶爸,8.6,857761,Mr. I Don't Care其实也有Care的时候。,皮艾尔·柯芬,...<br/>,喜剧,美国,2010
傲慢与偏见,8.7,702889,爱是摈弃傲慢与偏见之后的曙光。,乔·怀特,凯拉·奈特莉,剧情,法国,2005
玩具总动员3,8.9,454275,跨度十五年的欢乐与泪水。,李·昂克里奇,汤姆·汉克斯,喜剧,美国,2010
射雕英雄传之东成西就,8.7,572311,百看不厌。 ,刘镇伟,梁朝伟,喜剧,中国香港,1993
釜山行,8.6,1065735,揭露人性的丧尸题材力作。,延尚昊,孔侑,动作,韩国,2016
恐怖直播,8.7,583000,恐怖分子的“秋菊打官司”。,金秉祐,河正宇,剧情,韩国,2013
寄生虫,8.8,1226084,暂无介绍,奉俊昊,宋康昊,剧情,韩国,2019
被解救的姜戈,8.8,541415,热血沸腾，那个低俗、性感的无耻混蛋又来了。,昆汀·塔伦蒂诺,杰米·福克斯,剧情,美国,2012
未麻的部屋,9.0,273108,好的剧本是，就算你猜到了结局也猜不到全部。,今敏,岩男润子,动画,日本,1997
哪吒闹海,9.1,227638,想你时你在闹海。,王树忱,梁正晖,冒险,中国大陆,1979
血战钢锯岭,8.7,710700,优秀的战争片不会美化战场，不会粉饰死亡，不会矮化敌人，不会无视常识，最重要的，不会宣扬战争。,梅尔·吉布森,安德鲁·加菲尔德,剧情,澳大利亚,2016
头号玩家,8.7,1226449,写给影迷，动漫迷和游戏迷的一封情书。,史蒂文·斯皮尔伯格,泰伊·谢里丹,动作,美国,2018
我是山姆,9.0,292256,爱并不需要智商 。,杰茜·尼尔森,Sean,剧情,美国,2001
哈利·波特与火焰杯,8.7,552487,暂无介绍,迈克·内威尔,丹尼尔·雷德克里夫,悬疑,英国,2005
七武士,9.3,172921,时代悲歌。,黑泽明,三船敏郎,动作,日本,1954
新世界,8.9,346216,要做就做得狠一点，这样才能活下去。,朴勋政,李政宰,剧情,韩国,2013
喜宴,8.9,309312,中国家庭的喜怒哀乐忍。,李安,赵文瑄,剧情,中国台湾,1993
模仿游戏,8.7,560823,他给机器起名“克里斯托弗”，因为这是他初恋的名字。,莫滕·泰杜姆,本尼迪克特·康伯巴奇,剧情,英国,2014
黑客帝国3：矩阵革命,8.8,403002,不得不说，《黑客帝国》系列是商业片与科幻、哲学完美结合的典范。,信息不全,信息不全,信息不全,信息不全,信息不全
电锯惊魂,8.7,469369,真相就在眼前。,詹姆斯·温,雷·沃纳尔,悬疑,美国,2004
花样年华,8.7,524918,偷情本没有这样美。,王家卫,梁朝伟,剧情,中国香港,2000
三块广告牌,8.7,740864,怼天怼地，你走后，她与世界为敌。,马丁·麦克唐纳,弗兰西斯·麦克多蒙德,剧情,美国,2017
卢旺达饭店,8.9,288936,当这个世界闭上双眼，他却敞开了怀抱。,特瑞·乔治,唐·钱德尔,剧情,英国,2004
头脑特工队,8.8,536470,愿我们都不用长大，每一座城堡都能永远存在。,信息不全,信息不全,信息不全,信息不全,信息不全
你的名字。,8.5,1239843,穿越错位的时空，仰望陨落的星辰，你没留下你的名字，我却无法忘记那句“我爱你”。,新海诚,神木隆之介,剧情,日本,2016
疯狂原始人,8.7,762619,老少皆宜，这就是好莱坞动画的魅力。,信息不全,信息不全,信息不全,信息不全,信息不全
上帝之城,9.0,273730,被上帝抛弃了的上帝之城。,信息不全,信息不全,信息不全,信息不全,信息不全
达拉斯买家俱乐部,8.8,404296,Jared Leto的腿比女人还美！,让-马克·瓦雷,马修·麦康纳,剧情,美国,2013
谍影重重3,8.8,378082,像吃了苏打饼一样干脆的电影。,保罗·格林格拉斯,马特·达蒙,动作,美国,2007
风之谷,8.9,325248,动画片的圣经。,宫崎骏,岛本须美,动画,日本,1984
英雄本色,8.6,471054,英雄泪短，兄弟情长。 ,吴宇森,周润发,剧情,中国香港,1986
心迷宫,8.7,453985,荒诞讽刺，千奇百巧，抽丝剥茧，百转千回。,忻钰坤,霍卫民,剧情,中国大陆,2014
纵横四海,8.8,371442,香港浪漫主义警匪动作片的巅峰之作。,吴宇森,周润发,剧情,中国香港,1991
惊魂记,9.0,241653,故事的反转与反转，分裂电影的始祖。,阿尔弗雷德·希区柯克,安东尼·博金斯,悬疑,美国,1960
岁月神偷,8.7,532260,岁月流逝，来日可追。,罗启锐,吴君如,剧情,中国香港,2010
九品芝麻官,8.6,572412,暂无介绍,王晶,周星驰,剧情,中国香港,1994
记忆碎片,8.7,546327,一个针管引发的血案。,克里斯托弗·诺兰,盖·皮尔斯,犯罪,美国,2000
海街日记,8.8,388465,是枝裕和的家庭习作。,是枝裕和,绫濑遥,剧情,日本,2015
忠犬八公物语,9.2,171773,养狗三日，便会对你终其一生。,Seijirô,山本圭,剧情,日本,1987
荒蛮故事,8.8,392752,始于荒诞，止于更荒诞。,达米安·斯兹弗隆,达里奥·葛兰帝内提,剧情,阿根廷,2014
绿里奇迹,8.9,281596,天使暂时离开。,Frank,汤姆·汉克斯,犯罪,美国,1999
爆裂鼓手,8.7,512051,这个世界从不善待努力的人，努力了也不一定会成功，但是知道自己在努力，就是活下去的动力。,达米恩·查泽雷,迈尔斯·特勒,剧情,美国,2014
爱在午夜降临前,8.8,335782,所谓爱情，就是话唠一路，都不会心生腻烦，彼此嫌弃。,理查德·林克莱特,伊桑·霍克,剧情,美国,2013
贫民窟的百万富翁,8.6,678709,上帝之城+猜火车+阿甘正传+开心辞典=山寨富翁,丹尼·鲍尔,戴夫...<br/>,剧情,英国,2008
真爱至上,8.6,659732,爱，是个动词。,理查德·柯蒂斯,休·格兰特,喜剧,英国,2003
小偷家族,8.7,740974,我们组成了家。,是枝裕和,中川雅也,剧情,日本,2018
东邪西毒,8.6,523245,电影诗。,王家卫,张国荣,剧情,中国香港,1994
无敌破坏王,8.7,476971,迪士尼和皮克斯拿错剧本的产物。,瑞奇·莫尔,约翰·C·赖利,喜剧,美国,2012
疯狂的石头,8.5,726610,中国版《两杆大烟枪》。,宁浩,郭涛,喜剧,中国大陆,2006
色，戒,8.6,656510,假戏真情，爱欲深海,李安,梁朝伟,剧情,中国台湾,2007
冰川时代,8.6,552861,松鼠才是角儿。,信息不全,信息不全,信息不全,信息不全,信息不全
黑天鹅,8.6,724716,黑暗之美。,达伦·阿罗诺夫斯基,娜塔莉·波特曼,剧情,美国,2010
你看起来好像很好吃,8.9,299101,感情不分食草或者食肉。,藤森雅也,山口胜平,剧情,日本,2010
恐怖游轮,8.5,739990,不要企图在重复中寻找已经失去的爱。,克里斯托弗·史密斯,梅利莎·乔治,剧情,英国,2009
雨中曲,9.1,190233,骨灰级歌舞片。,斯坦利·多南,吉恩·...<br/>,喜剧,美国,1952
雨人,8.7,365817,生活在自己的世界里，也可以让周围的人显得可笑和渺小。,巴瑞·莱文森,达斯汀·霍夫曼,剧情,美国,1988
恋恋笔记本,8.6,594419,爱情没有那么多借口，如果不能圆满，只能说明爱的不够。 ,尼克·卡索维茨,瑞恩·高斯林,剧情,美国,2004
2001太空漫游,8.9,273857,现代科幻电影的开山之作，最伟大导演的最伟大影片。,斯坦利·库布里克,凯尔·杜拉,科幻,英国,1968
魔女宅急便,8.7,407947,宫崎骏的电影总让人感觉世界是美好的，阳光明媚的。,宫崎骏,高山南,动画,日本,1989
萤火虫之墓,8.7,374154,幸福是生生不息，却难以触及的远。 ,高畑勋,辰己努,动画,日本,1988
城市之光,9.3,125136,永远的小人物，伟大的卓别林。,Charles,查理·卓别林,喜剧,美国,1931
可可西里,8.8,267408,坚硬的信仰。,陆川,多布杰,剧情,中国大陆,2004
遗愿清单,8.7,382031,用剩余不多的时间，去燃烧整个生命。,罗伯·莱纳,杰克·尼科尔森,冒险,美国,2007
虎口脱险,8.9,222616,永远看不腻的喜剧。,杰拉尔·乌里,路易·德·菲耐斯,喜剧,法国,1966
大佛普拉斯,8.7,385226,人们可以登上月球，却永远无法探索人们内心的宇宙。,黄信尧,庄益增,剧情,中国台湾,2017
人工智能,8.7,395331,对爱的执着，可以超越一切。,史蒂文·斯皮尔伯格,海利·乔·奥斯蒙,剧情,美国,2001
初恋这件小事,8.4,903763,黑小鸭速效美白记。,信息不全,信息不全,信息不全,信息不全,信息不全
牯岭街少年杀人事件,8.9,245599,弱者送给弱者的一刀。,杨德昌,张震,剧情,中国台湾,1991
源代码,8.5,752404,邓肯·琼斯继《月球》之后再度奉献出一部精彩绝伦的科幻佳作。,邓肯·琼斯,杰克·吉伦哈尔,科幻,美国,2011
无间道2,8.7,398926,暂无介绍,刘伟强,陈冠希,剧情,中国香港,2003
海边的曼彻斯特,8.6,443008,我们都有权利不与自己的过去和解。,肯尼斯·罗纳根,卡西·阿弗莱克,剧情,美国,2016
茶馆,9.5,94505,暂无介绍,谢添,于是之,剧情,中国大陆,1982
罗生门,8.8,277398,人生的N种可能性。,黑泽明,三船敏郎,剧情,日本,1950
